[
  {"decision_id":"D1","decision_point":"Choose reading","target_object":"interpretation:I1","alternatives":["A","B"],"evidence_considered":["E1"],"interpretations_considered":["A","B"],"counterarguments_considered":[],"agent_recommendations":[{"recommendation":"A"}],"researcher_decision":"B","rationale":"B accounts for the anomaly.","decision_status":"REOPENED","authorized_by":"researcher:R1","authorization_ref":"approval:example:D1-reopen","proposal_digest":"sha256:1111111111111111111111111111111111111111111111111111111111111111","decided_at":"2026-08-18T00:00:00Z","supersedes":"D0"},
  {"decision_id":"D2","decision_point":"Reconsider reading after E2","target_object":"interpretation:I2","alternatives":["B","qualified B"],"evidence_considered":["E1","E2"],"interpretations_considered":["B","qualified B"],"counterarguments_considered":["E2 limits B"],"agent_recommendations":[{"recommendation":"qualified B"}],"researcher_decision":"qualified B","rationale":"New evidence narrows but does not erase B.","decision_status":"ACCEPTED","authorized_by":"researcher:R1","authorization_ref":"approval:example:D2","proposal_digest":"sha256:2222222222222222222222222222222222222222222222222222222222222222","decided_at":"2026-08-20T00:00:00Z","supersedes":"D1"}
]
