{
  "decision_id":"D2","decision_point":"Respond to E7","target_object":"question:Q1","alternatives":["retain Q1 and dispute E7","revise Q1 to a transformation question","withdraw the project"],"evidence_considered":["E7"],"interpretations_considered":["origination","bounded transformation"],"counterarguments_considered":["E7 may be exceptional"],"agent_recommendations":[{"recommendation":"revise Q1 to a transformation question"}],"researcher_decision":"revise Q1 to a transformation question","rationale":"E7 defeats the origination premise but leaves a transformation claim answerable.","decision_status":"ACCEPTED","authorized_by":"researcher:R1","authorization_ref":"approval:example:D2","proposal_digest":"sha256:4444444444444444444444444444444444444444444444444444444444444444","decided_at":"2026-08-20T00:00:00Z","supersedes":"D1"
}
